{
  "measurement_id": "meas-2026-10-18-0002",
  "candidate_id": "cand-2026-10-18-0001",
  "capability_id": "CAP-MEA-04",
  "measurement_type": "RECENCY",
  "value": {
    "label": "RECENT",
    "label_set": "RECENCY/1.0",
    "score": null,
    "probabilities": null
  },
  "state": {
    "status": "OK"
  },
  "evidence_refs": [
    "store/raw/cand-0001.txt#L1-L40"
  ],
  "contradictions": [],
  "uncertainties": [],
  "language_context": {
    "source_language": "en",
    "judgment_language": "en",
    "input_representation": "ORIGINAL_SOURCE_TEXT",
    "translation_ref": null
  },
  "method": {
    "kind": "CODE",
    "model_profile_id": null,
    "model_revision": null,
    "adapter_version": null,
    "calibration_profile_id": null
  },
  "measured_at": "2026-10-18T00:20:00+08:00",
  "contract_version": "1.1",
  "trace_ref": "trace/2026-10-18/run-0001/invoke-7"
}
